Nombre,Categoria,Especialidad,Dirección,CP,Municipio/Área,Teléfono,WhatsApp,Email,Web,Notas,Fuente,Valoración_Google
Carpintería San José,Carpintería de madera,Muebles de madera a medida; reparaciones,,,València,+34 658 44 37 29,+34 658 44 37 29,,https://carpinteriasanjose.es/,Taller propio; trabajos a medida,carpinteriasanjose.es,
Madentia,Carpintería técnica,"Carpintería a medida (servicio 360: diseño, producción, instalación)",,,València (área metropolitana),,,,https://madentia.es/,Taller a pocos km de Valencia,madentia.es,
Ebanistería Rafael Hernández,Ebanistería,Muebles a medida; ebanistería,,,València (provincia),+34 670 29 64 61,+34 670 29 64 61,,https://ebanrhh.es/,Proyectos personalizados,ebanrhh.es,
Fustería Soler,Carpintería de madera,Trabajos personalizados; taller en Manises,,46940,Manises (Valencia),,,,https://www.fusteriasoler.es/,Servicio a Valencia y alrededores,fusteriasoler.es,
El Taller de Carola,Carpintería de madera,Carpintería a medida,,,València,,,,https://eltallerdecarola.com/,Diseño y fabricación a medida,eltallerdecarola.com,
