Nombre,Categoria,Especialidad,Dirección,CP,Municipio/Área,Teléfono,WhatsApp,Email,Web,Notas,Fuente,Valoración_Google
Ramiro Hermanos,Acero inoxidable / Metal,Mobiliario y componentes inox a medida; contract,C/ Campos Crespo 37,46017,València,+34 963 77 05 90,,info@ramirohermanos.es,https://ramirohermanos.es/,Especialistas en mobiliario y piezas a medida,ramirohermanos.es,
RNSinox,Calderería fina inox,Transformación de acero inoxidable; fabricación a medida,C/ Huelva 17,46113,Moncada (Valencia),+34 961 39 13 05,,rnsinox@rnsinox.com,https://rnsinox.com/,Desde 1965; calderería fina,rnsinox.com,
Noumetall Sistemes,Carpintería metálica / Inox,"Mobiliario y decoración en inox, hierro, aluminio y vidrio","C/ Dels Fornillers, 1-B (PI)",46192,Montserrat (Valencia),+34 962 999 005,+34 672 32 63 73,comercial_luz@metalicasluz.es,https://www.noumetall.com/,Soluciones a medida para retail y hostelería,noumetall.com,
Muebles Metálicos Herta,Mobiliario inox hostelería,Fabricación de mobiliario metálico para hostelería,"Travesía de la Peralta s/n, Polígono 7",46540,El Puig (Valencia),+34 961 47 11 29,+34 633 211 890,,https://mueblesherta.com/,Fabricante nacional con sede en Valencia,mueblesherta.com,
Talleres Villalón,Calderería acero inoxidable,"Depósitos, tanques e instalaciones en inox",C/ Campellos 9 y 11,46450,Benifaió (Valencia),,,contacta@talleresvillalon.com,https://www.talleresvillalon.com/,Depósitos y obra de calderería,talleresvillalon.com,
Talleres Áncora,Calderería / Inox,"Barandillas, escaleras, campanas, tuberías (agua/gas/vapor)",,,València (provincia),,,,https://www.talleresancorasl.es/,Expertos en acero inoxidable y mantenimientos,talleresancorasl.es,
